{
  "entity_id": "wyvern",
  "name": "Wyvern",
  "category": "Creature",
  "magic_school": "Wild",
  "rank": "II",
  "description": "Flying dragonkin that attacks with mid-range projectiles.",
  "image_required": true,
  "last_modified": "2026-02-09T21:43:19.931585+00:00",
  "tags": [],
  "changelog": [
    {
      "version": "0.0.1",
      "date": "2026-02-08T09:49:16.842389+00:00",
      "description": "Initial Closed Beta 2 Data"
    }
  ],
  "damage": 45,
  "mechanics": {
    "damage_modifiers": [
      {
        "target_type": "Building",
        "multiplier": 0.9,
        "condition": "Always"
      }
    ]
  },
  "health": 350,
  "movement_speed": 4,
  "movement_type": "Flying"
}
