{
  "entity_id": "fire_ray",
  "name": "Fire Ray",
  "category": "Spell",
  "magic_school": "Elemental",
  "rank": "I",
  "description": "Focused beam that deals low Fire damage.",
  "image_required": true,
  "last_modified": "2026-02-08T14:59:13.827448+00:00",
  "tags": [],
  "changelog": [
    {
      "version": "0.0.1",
      "date": "2026-02-08T09:49:16.836670+00:00",
      "description": "Initial Closed Beta 2 Data"
    }
  ],
  "damage": 70,
  "range": 45
}
