{
  "entity_id": "astral_nova",
  "name": "Astral Nova",
  "category": "Spell",
  "magic_school": "Astral",
  "rank": "IV",
  "description": "Massive projectile that deals heavy damage on impact.",
  "image_required": true,
  "last_modified": "2026-02-08T14:59:13.824682+00:00",
  "tags": [],
  "changelog": [
    {
      "version": "0.0.1",
      "date": "2026-02-08T09:49:16.846742+00:00",
      "description": "Initial Closed Beta 2 Data"
    }
  ],
  "damage": 4200,
  "range": 80
}
